{
  "filename": "file05.pdf",
  "content": "ADDRESS: \nTOPJUMP \n3735 PARKWAY \nPIGEON FORGE, TN 37863 \n(NEAR DIXIE STAMPEDE ON THE PARKWAY) \nRSVP: ----------------\nCLOSED TOED SHOES ARE REQUIRED FOR CLIMBING \nPARENTS OR GUARDIANS NOT ATTENDING THE PARTY, \nPLEASE VISIT TOPJUMP.COM TO FILL OUT WAIVER \nSO YOUR CHILD CAN ATTEND. \nHOPE To SEE You THERE! \nWWW.TOPJUMP.COM ",
  "sections": [
    {
      "title": "Introduction",
      "text": "ADDRESS: \n"
    },
    {
      "title": "TOPJUMP",
      "text": "3735 PARKWAY \nPIGEON FORGE, TN 37863 \n(NEAR DIXIE STAMPEDE ON THE PARKWAY) \nRSVP: ----------------\n"
    },
    {
      "title": "CLOSED TOED SHOES ARE REQUIRED FOR CLIMBING",
      "text": "PARENTS OR GUARDIANS NOT ATTENDING THE PARTY, \nPLEASE VISIT TOPJUMP.COM TO FILL OUT WAIVER \nSO YOUR CHILD CAN ATTEND. \nHOPE To SEE You THERE! \nWWW.TOPJUMP.COM \n"
    }
  ],
  "tables": [],
  "images": [
    {
      "page": 1,
      "image_file": "images/page1_img1.jpeg"
    },
    {
      "page": 1,
      "image_file": "images/page1_img2.png"
    }
  ]
}